{
  "kunye": {
    "sembol": "THYAO",
    "ad": "Türk Hava Yolları",
    "zaman_dilimi": "1G",
    "strateji": "swing-fib-abcd",
    "strateji_adi": "Salınım Fibo ABCD",
    "yon": "sat",
    "durum": "tamamlandı",
    "ornek_mi": true
  },
  "paneller": [
    {
      "id": "fiyat",
      "tur": "fiyat",
      "oran": 0.76,
      "y": {
        "alt": 143.85,
        "ust": 213.25,
        "gerekce": "1.618 (azami risk) seviyesi mum aralığının dışında kalıyor; merdivenin tamamı görünmezse 'nereye kadar düşebilir' sorusu grafikte cevaplanamaz."
      }
    },
    {
      "id": "hacim",
      "tur": "hacim",
      "oran": 0.24
    }
  ],
  "seriler": [
    {
      "id": "mum",
      "panel": "fiyat",
      "veri": [
        {
          "t": 1772409600,
          "acilis": 182.05,
          "yuksek": 183.24,
          "dusuk": 181.13,
          "kapanis": 181.13
        },
        {
          "t": 1772496000,
          "acilis": 181.68,
          "yuksek": 182.25,
          "dusuk": 180.55,
          "kapanis": 180.74
        },
        {
          "t": 1772582400,
          "acilis": 181.66,
          "yuksek": 182.26,
          "dusuk": 179.52,
          "kapanis": 181.05
        },
        {
          "t": 1772668800,
          "acilis": 181.26,
          "yuksek": 182.82,
          "dusuk": 178.91,
          "kapanis": 180.01
        },
        {
          "t": 1772755200,
          "acilis": 179.01,
          "yuksek": 180.59,
          "dusuk": 177.32,
          "kapanis": 178.72
        },
        {
          "t": 1773014400,
          "acilis": 178.82,
          "yuksek": 180.96,
          "dusuk": 177.35,
          "kapanis": 180.06
        },
        {
          "t": 1773100800,
          "acilis": 178.94,
          "yuksek": 179.41,
          "dusuk": 177.33,
          "kapanis": 179.26
        },
        {
          "t": 1773187200,
          "acilis": 178.06,
          "yuksek": 179.42,
          "dusuk": 176.53,
          "kapanis": 177.71
        },
        {
          "t": 1773273600,
          "acilis": 176.6,
          "yuksek": 178.64,
          "dusuk": 175.49,
          "kapanis": 177.24
        },
        {
          "t": 1773360000,
          "acilis": 177.42,
          "yuksek": 178.75,
          "dusuk": 175.58,
          "kapanis": 176.15
        },
        {
          "t": 1773619200,
          "acilis": 175.11,
          "yuksek": 176.21,
          "dusuk": 174.08,
          "kapanis": 174.36
        },
        {
          "t": 1773705600,
          "acilis": 174.33,
          "yuksek": 175.21,
          "dusuk": 173.3,
          "kapanis": 173.89
        },
        {
          "t": 1773792000,
          "acilis": 171.89,
          "yuksek": 172.53,
          "dusuk": 171.87,
          "kapanis": 172.48
        },
        {
          "t": 1773878400,
          "acilis": 172.1,
          "yuksek": 173.04,
          "dusuk": 170.93,
          "kapanis": 171.07
        },
        {
          "t": 1773964800,
          "acilis": 172.42,
          "yuksek": 173.28,
          "dusuk": 169.32,
          "kapanis": 170.27
        },
        {
          "t": 1774224000,
          "acilis": 172.19,
          "yuksek": 172.54,
          "dusuk": 170.23,
          "kapanis": 170.89
        },
        {
          "t": 1774310400,
          "acilis": 172.14,
          "yuksek": 173.42,
          "dusuk": 170.32,
          "kapanis": 170.89
        },
        {
          "t": 1774396800,
          "acilis": 170.45,
          "yuksek": 171.05,
          "dusuk": 168.95,
          "kapanis": 170.52
        },
        {
          "t": 1774483200,
          "acilis": 171.27,
          "yuksek": 172.05,
          "dusuk": 170.1,
          "kapanis": 170.57
        },
        {
          "t": 1774569600,
          "acilis": 169.28,
          "yuksek": 172.08,
          "dusuk": 168.34,
          "kapanis": 170.89
        },
        {
          "t": 1774828800,
          "acilis": 170.77,
          "yuksek": 171.33,
          "dusuk": 170.16,
          "kapanis": 171.15
        },
        {
          "t": 1774915200,
          "acilis": 171.52,
          "yuksek": 173.36,
          "dusuk": 171.38,
          "kapanis": 171.91
        },
        {
          "t": 1775001600,
          "acilis": 172.29,
          "yuksek": 174.46,
          "dusuk": 170.69,
          "kapanis": 173.16
        },
        {
          "t": 1775088000,
          "acilis": 173.21,
          "yuksek": 174.37,
          "dusuk": 172.8,
          "kapanis": 172.93
        },
        {
          "t": 1775174400,
          "acilis": 173.87,
          "yuksek": 174.76,
          "dusuk": 172.57,
          "kapanis": 173.88
        },
        {
          "t": 1775433600,
          "acilis": 174.07,
          "yuksek": 175.43,
          "dusuk": 173.98,
          "kapanis": 175.16
        },
        {
          "t": 1775520000,
          "acilis": 177.01,
          "yuksek": 179.15,
          "dusuk": 176.83,
          "kapanis": 178.15
        },
        {
          "t": 1775606400,
          "acilis": 178.26,
          "yuksek": 179.22,
          "dusuk": 177.31,
          "kapanis": 178.0
        },
        {
          "t": 1775692800,
          "acilis": 179.26,
          "yuksek": 181.3,
          "dusuk": 178.27,
          "kapanis": 181.22
        },
        {
          "t": 1775779200,
          "acilis": 183.4,
          "yuksek": 183.64,
          "dusuk": 180.97,
          "kapanis": 182.04
        },
        {
          "t": 1776038400,
          "acilis": 184.08,
          "yuksek": 185.26,
          "dusuk": 183.39,
          "kapanis": 183.53
        },
        {
          "t": 1776124800,
          "acilis": 185.75,
          "yuksek": 187.06,
          "dusuk": 185.1,
          "kapanis": 185.25
        },
        {
          "t": 1776211200,
          "acilis": 187.01,
          "yuksek": 188.39,
          "dusuk": 186.91,
          "kapanis": 188.11
        },
        {
          "t": 1776297600,
          "acilis": 188.54,
          "yuksek": 191.45,
          "dusuk": 187.46,
          "kapanis": 190.43
        },
        {
          "t": 1776384000,
          "acilis": 190.96,
          "yuksek": 192.73,
          "dusuk": 190.08,
          "kapanis": 191.49
        },
        {
          "t": 1776643200,
          "acilis": 193.36,
          "yuksek": 195.49,
          "dusuk": 192.12,
          "kapanis": 194.22
        },
        {
          "t": 1776729600,
          "acilis": 195.5,
          "yuksek": 196.67,
          "dusuk": 195.5,
          "kapanis": 196.25
        },
        {
          "t": 1776816000,
          "acilis": 198.82,
          "yuksek": 199.11,
          "dusuk": 198.02,
          "kapanis": 198.28
        },
        {
          "t": 1776902400,
          "acilis": 199.98,
          "yuksek": 200.8,
          "dusuk": 197.05,
          "kapanis": 198.47
        },
        {
          "t": 1776988800,
          "acilis": 199.75,
          "yuksek": 202.58,
          "dusuk": 198.58,
          "kapanis": 201.88
        },
        {
          "t": 1777248000,
          "acilis": 200.8,
          "yuksek": 202.23,
          "dusuk": 200.57,
          "kapanis": 201.49
        },
        {
          "t": 1777334400,
          "acilis": 203.75,
          "yuksek": 205.81,
          "dusuk": 202.99,
          "kapanis": 204.46
        },
        {
          "t": 1777420800,
          "acilis": 204.13,
          "yuksek": 205.75,
          "dusuk": 202.98,
          "kapanis": 205.26
        },
        {
          "t": 1777507200,
          "acilis": 205.91,
          "yuksek": 207.07,
          "dusuk": 205.73,
          "kapanis": 207.06
        },
        {
          "t": 1777593600,
          "acilis": 208.09,
          "yuksek": 208.12,
          "dusuk": 206.45,
          "kapanis": 207.38
        },
        {
          "t": 1777852800,
          "acilis": 208.99,
          "yuksek": 209.32,
          "dusuk": 206.31,
          "kapanis": 207.3
        },
        {
          "t": 1777939200,
          "acilis": 207.68,
          "yuksek": 210.99,
          "dusuk": 207.49,
          "kapanis": 210.02
        },
        {
          "t": 1778025600,
          "acilis": 207.18,
          "yuksek": 210.67,
          "dusuk": 206.09,
          "kapanis": 210.35
        },
        {
          "t": 1778112000,
          "acilis": 207.93,
          "yuksek": 209.1,
          "dusuk": 207.15,
          "kapanis": 208.63
        },
        {
          "t": 1778198400,
          "acilis": 208.71,
          "yuksek": 209.08,
          "dusuk": 208.13,
          "kapanis": 208.26
        },
        {
          "t": 1778457600,
          "acilis": 209.19,
          "yuksek": 210.4,
          "dusuk": 206.27,
          "kapanis": 207.51
        },
        {
          "t": 1778544000,
          "acilis": 209.54,
          "yuksek": 211.1,
          "dusuk": 206.7,
          "kapanis": 207.81
        },
        {
          "t": 1778630400,
          "acilis": 206.43,
          "yuksek": 208.46,
          "dusuk": 205.06,
          "kapanis": 207.15
        },
        {
          "t": 1778716800,
          "acilis": 205.1,
          "yuksek": 207.1,
          "dusuk": 203.53,
          "kapanis": 206.18
        },
        {
          "t": 1778803200,
          "acilis": 204.23,
          "yuksek": 205.49,
          "dusuk": 202.82,
          "kapanis": 203.68
        },
        {
          "t": 1779062400,
          "acilis": 202.95,
          "yuksek": 203.37,
          "dusuk": 201.54,
          "kapanis": 202.62
        },
        {
          "t": 1779148800,
          "acilis": 201.62,
          "yuksek": 202.65,
          "dusuk": 200.16,
          "kapanis": 201.56
        },
        {
          "t": 1779235200,
          "acilis": 200.98,
          "yuksek": 201.99,
          "dusuk": 198.33,
          "kapanis": 198.8
        },
        {
          "t": 1779321600,
          "acilis": 198.29,